{
  "version": 1,
  "title": "Northwind Systems",
  "description": "B2B software company \u00b7 349 people \u00b7 fictional demo data",
  "children": [
    {
      "id": "sources",
      "title": "Data sources",
      "description": "Where the company's knowledge actually lives.",
      "value": "6 sources",
      "children": [
        {
          "id": "emails",
          "title": "Emails",
          "description": "Every email in and out of the company.",
          "value": "1.2M emails",
          "color": "#3b82f6",
          "region": "frontal",
          "children": [
            {
              "id": "em-shared",
              "title": "Shared inboxes",
              "description": "support@, sales@, billing@ \u2014 the front doors.",
              "value": "380K",
              "children": [
                {
                  "id": "em-support",
                  "title": "support@",
                  "description": "Where customers write in when something breaks.",
                  "value": "210K"
                },
                {
                  "id": "em-sales",
                  "title": "sales@",
                  "description": "Inbound interest and quote requests.",
                  "value": "120K"
                },
                {
                  "id": "em-billing",
                  "title": "billing@",
                  "description": "Invoices, receipts and payment questions.",
                  "value": "50K"
                }
              ]
            },
            {
              "id": "em-reps",
              "title": "Personal mailboxes",
              "description": "Each person's own inbox.",
              "value": "740K",
              "children": [
                {
                  "id": "em-active",
                  "title": "Live threads",
                  "description": "Replied to in the last week.",
                  "value": "6.2K"
                },
                {
                  "id": "em-quiet",
                  "title": "Gone quiet",
                  "description": "No reply in 30+ days.",
                  "value": "2.4K"
                }
              ]
            },
            {
              "id": "em-outbound",
              "title": "Outbound campaigns",
              "description": "Newsletters and sequences we send.",
              "value": "96K"
            },
            {
              "id": "em-attach",
              "title": "Attachments",
              "description": "Contracts, decks and spreadsheets people mailed around.",
              "value": "210K files"
            }
          ]
        },
        {
          "id": "chat",
          "title": "Company Chat",
          "description": "Slack and Teams \u2014 where the day-to-day actually happens.",
          "value": "4.8M messages",
          "color": "#a78bfa",
          "region": "temporal",
          "children": [
            {
              "id": "ch-eng",
              "title": "#engineering",
              "description": "Builds, bugs and design debates.",
              "value": "1.4M"
            },
            {
              "id": "ch-support",
              "title": "#support",
              "description": "Live triage and customer escalations.",
              "value": "890K"
            },
            {
              "id": "ch-sales",
              "title": "#sales",
              "description": "Deals in flight and competitive intel.",
              "value": "620K"
            },
            {
              "id": "ch-general",
              "title": "#general",
              "description": "Announcements and everything else.",
              "value": "310K"
            },
            {
              "id": "ch-dms",
              "title": "Direct messages",
              "description": "The private half of the company.",
              "value": "1.5M"
            },
            {
              "id": "ch-meetings",
              "title": "Huddles & meeting notes",
              "description": "Recorded calls and their summaries.",
              "value": "12K"
            }
          ]
        },
        {
          "id": "crm",
          "title": "CRM",
          "description": "Accounts, deals and everything sales logs.",
          "value": "760K records",
          "color": "#34d399",
          "region": "stem",
          "children": [
            {
              "id": "crm-accounts",
              "title": "Accounts",
              "description": "Every company we sell to or want to.",
              "value": "12.4K",
              "children": [
                {
                  "id": "crm-customers",
                  "title": "Customers",
                  "description": "Paying today.",
                  "value": "3.1K"
                },
                {
                  "id": "crm-prospects",
                  "title": "Prospects",
                  "description": "In the pipeline, not yet closed.",
                  "value": "9.3K"
                }
              ]
            },
            {
              "id": "crm-contacts",
              "title": "Contacts",
              "description": "The people at those companies.",
              "value": "84K"
            },
            {
              "id": "crm-deals",
              "title": "Deals",
              "description": "Opportunities and where they landed.",
              "value": "21K",
              "children": [
                {
                  "id": "crm-open",
                  "title": "Open pipeline",
                  "description": "Live opportunities.",
                  "value": "$48M"
                },
                {
                  "id": "crm-won",
                  "title": "Won",
                  "description": "Closed and signed.",
                  "value": "8.4K"
                },
                {
                  "id": "crm-lost",
                  "title": "Lost",
                  "description": "With the reason why.",
                  "value": "11K"
                }
              ]
            },
            {
              "id": "crm-activity",
              "title": "Activity log",
              "description": "Calls, notes and next steps against each account.",
              "value": "640K"
            }
          ]
        },
        {
          "id": "tickets",
          "title": "Support Tickets",
          "description": "Every problem a customer has reported.",
          "value": "212K tickets",
          "color": "#fbbf24",
          "region": "parietal",
          "children": [
            {
              "id": "tk-open",
              "title": "Open",
              "description": "Waiting on us right now.",
              "value": "1.4K",
              "children": [
                {
                  "id": "tk-new",
                  "title": "New",
                  "description": "Not yet triaged.",
                  "value": "310"
                },
                {
                  "id": "tk-progress",
                  "title": "In progress",
                  "description": "Someone is on it.",
                  "value": "780"
                },
                {
                  "id": "tk-waiting",
                  "title": "Waiting on customer",
                  "description": "Ball in their court.",
                  "value": "310"
                }
              ]
            },
            {
              "id": "tk-solved",
              "title": "Solved",
              "description": "Closed, with how it was fixed.",
              "value": "210K"
            },
            {
              "id": "tk-escalations",
              "title": "Escalations",
              "description": "Went past first line.",
              "value": "320"
            },
            {
              "id": "tk-kb",
              "title": "Help articles",
              "description": "The answers we wrote down.",
              "value": "1.8K"
            },
            {
              "id": "tk-csat",
              "title": "Satisfaction scores",
              "description": "What customers said afterwards.",
              "value": "42K"
            }
          ]
        },
        {
          "id": "calls",
          "title": "Phone Calls",
          "description": "Recorded and transcribed conversations.",
          "value": "254K calls",
          "color": "#fb923c",
          "region": "occipital",
          "children": [
            {
              "id": "ca-support",
              "title": "Support calls",
              "description": "Customers on the phone with an issue.",
              "value": "140K"
            },
            {
              "id": "ca-sales",
              "title": "Sales calls",
              "description": "Demos, discovery and negotiations.",
              "value": "96K",
              "children": [
                {
                  "id": "ca-demo",
                  "title": "Demos",
                  "description": "First real look at the product.",
                  "value": "38K"
                },
                {
                  "id": "ca-negotiation",
                  "title": "Negotiations",
                  "description": "Pricing and terms.",
                  "value": "12K"
                }
              ]
            },
            {
              "id": "ca-voicemail",
              "title": "Voicemails",
              "description": "Missed, left as a message.",
              "value": "18K"
            },
            {
              "id": "ca-transcripts",
              "title": "Transcripts",
              "description": "Searchable text of every call.",
              "value": "254K"
            }
          ]
        },
        {
          "id": "accounting",
          "title": "Accounting",
          "description": "Money in, money out, and the paperwork.",
          "value": "$92M tracked",
          "color": "#f472b6",
          "region": "temporal",
          "children": [
            {